{
  "projectName": "Aguiar2019ooco",
  "displayName": "Aguiar 2019 Object Oriented Example",
  "publisher": "Aguiar",
  "version": "1.0.0",
  "license": "MIT",
  "dependencies": {
    "SWO": {
      "url": "https://github.com/SWO",
      "version": "1.0.0"
    },
    "SPO": {
      "url": "https://github.com/SPO",
      "version": "1.0.0"
    }
  },
  "outFolder": "out"
}